country,partner,min_n_per_wave,psu_definition,status,signed_date,loi_path,status_notes
United Arab Emirates,GulfPulse Research FZ-LLC,400,"City (Abu Dhabi/Dubai/Sharjah/Ras Al Khaimah) × recruiter",countersigned,2025-11-09,docs/h3_country_expansion_materials/LOI_UAE_2025-11-09.md,"Countersigned PDF archived 2025-11-09; Arabic translation notarization due 2025-11-15."
Singapore,Strait Horizons Insights Pte Ltd,450,"Planning area × panel source",countersigned,2025-11-09,docs/h3_country_expansion_materials/LOI_Singapore_2025-11-09.md,"Digital signature verified 2025-11-09; compliance walkthrough scheduled 2025-11-12 to align PSU documentation."
Switzerland,Helvetic Panel Group AG,420,"Canton × panel provider",countersigned,2025-11-10,docs/h3_country_expansion_materials/LOI_Switzerland_2025-11-09.md,"DocuSign envelope 1e5b-25 confirmed 2025-11-10 07:55 UTC; bilingual confidentiality annex uploaded with the LOI."
China,JadeVista Social Metrics Co.,600,"City × panel provider",awaiting_signature,,docs/h3_country_expansion_materials/LOI_China_2025-11-09.md,"Awaiting board approval after 2025-11-10 finance review; follow-up call booked 2025-11-11."
Saudi Arabia,Al-Najd Policy Lab,400,"Governorate × recruitment channel",countersigned,2025-11-10,docs/h3_country_expansion_materials/LOI_SaudiArabia_2025-11-09.md,"Countersigned PDF plus Arabic rider received 2025-11-10 09:28 UTC; compliance flagged no outstanding issues."
Australia,Southern Cross Fieldwork Pty Ltd,420,"SA4 × recruitment list",awaiting_signature,,docs/h3_country_expansion_materials/LOI_Australia_2025-11-09.md,"Working through GST invoicing clause; procurement follow-up scheduled 2025-11-11."
Canada,Northward Data Cooperative,430,"CMA × recruitment panel",awaiting_signature,,docs/h3_country_expansion_materials/LOI_Canada_2025-11-09.md,"Updated incentive script shared 2025-11-09; awaiting executive sign-off."
South Korea,HanRiver Social Research Co.,430,"Metro area × recruitment list",awaiting_signature,,docs/h3_country_expansion_materials/LOI_SouthKorea_2025-11-09.md,"Panel operations confirming quota controls; expect signature after 2025-11-12 steering call."
